No.,Time,Source,Destination,Protocol,Length,Source Port,Destination Port,Host,Server,Source Mac,Dest Mac,Info
1,2010-02-02 09:40:36,164.124.33.78,164.124.33.78,TCP,54,35165,80,164.124.33.78,192.168.0.1,00:19:30:c0:ff:ee,00:0e:0c:c0:ff:ee,35165  >  80 [SYN] Seq=0 Win=16384 Len=0
2,2010-02-02 09:40:36,38.198.26.9,38.198.26.9,TCP,54,14378,80,38.198.26.9,192.168.0.1,00:19:30:c0:ff:ee,00:0e:0c:c0:ff:ee,14378  >  80 [SYN] Seq=0 Win=16384 Len=0
3,2010-02-02 09:40:36,132.212.36.201,132.212.36.201,TCP,54,31944,80,132.212.36.201,192.168.0.1,00:19:30:c0:ff:ee,00:0e:0c:c0:ff:ee,31944  >  80 [SYN] Seq=0 Win=16384 Len=0
4,2010-02-02 09:40:36,76.196.6.157,76.196.6.157,TCP,54,10404,80,76.196.6.157,192.168.0.1,00:19:30:c0:ff:ee,00:0e:0c:c0:ff:ee,10404  >  80 [RST] Seq=1 Win=0 Len=0
5,2010-02-02 09:40:36,189.109.37.180,189.109.37.180,TCP,54,36076,80,189.109.37.180,192.168.0.1,00:19:30:c0:ff:ee,00:0e:0c:c0:ff:ee,36076  >  80 [SYN] Seq=0 Win=16384 Len=0
6,2010-02-02 09:40:36,189.109.37.188,189.109.37.188,TCP,54,36084,80,189.109.37.180,192.168.0.1,00:19:30:c0:ff:ee,00:0e:0c:c0:ff:ee,36084  >  80 [SYN] Seq=0 Win=16384 Len=0
7,2010-02-02 09:40:36,76.196.12.251,76.196.12.251,TCP,54,12034,80,76.196.12.251,192.168.0.1,00:19:30:c0:ff:ee,00:0e:0c:c0:ff:ee,12034  >  80 [SYN] Seq=0 Win=16384 Len=0
8,2010-02-02 09:40:36,132.212.36.146,132.212.36.146,TCP,54,31889,80,132.212.36.146,192.168.0.1,00:19:30:c0:ff:ee,00:0e:0c:c0:ff:ee,31889  >  80 [SYN] Seq=0 Win=16384 Len=0
9,2010-02-02 09:40:36,189.109.30.67,189.109.30.67,TCP,54,34171,80,189.109.37.67,192.168.0.1,00:19:30:c0:ff:ee,00:0e:0c:c0:ff:ee,34171  >  80 [RST] Seq=1 Win=0 Len=0
10,2010-02-02 09:40:36,189.109.37.184,189.109.37.184,TCP,54,36080,80,189.109.37.184,192.168.0.1,00:19:30:c0:ff:ee,00:0e:0c:c0:ff:ee,36080  >  80 [SYN] Seq=0 Win=16384 Len=0
11,2010-02-02 09:40:36,164.124.33.164,164.124.33.164,TCP,54,35251,80,164.124.33.164,192.168.0.1,00:19:30:c0:ff:ee,00:0e:0c:c0:ff:ee,35251  >  80 [SYN] Seq=0 Win=16384 Len=0
12,2010-02-02 09:40:36,189.109.37.88,189.109.37.88,TCP,54,35984,80,189.109.37.88,192.168.0.1,00:19:30:c0:ff:ee,00:0e:0c:c0:ff:ee,35984  >  80 [SYN] Seq=0 Win=16384 Len=0
13,2010-02-02 09:40:36,76.196.12.188,76.196.12.188,TCP,54,11971,80,76.196.12.188,192.168.0.1,00:19:30:c0:ff:ee,00:0e:0c:c0:ff:ee,11971  >  80 [SYN] Seq=0 Win=16384 Len=0
14,2010-02-02 09:40:36,132.212.36.112,132.212.36.112,TCP,54,31855,80,132.212.36.112,192.168.0.1,00:19:30:c0:ff:ee,00:0e:0c:c0:ff:ee,31855  >  80 [SYN] Seq=0 Win=16384 Len=0
15,2010-02-02 09:40:36,164.124.33.95,164.124.33.95,TCP,54,35182,80,164.124.33.95,192.168.0.1,00:19:30:c0:ff:ee,00:0e:0c:c0:ff:ee,35182  >  80 [SYN] Seq=0 Win=16384 Len=0
16,2010-02-02 09:40:36,76.196.12.250,76.196.12.250,TCP,54,12033,80,76.196.12.250,192.168.0.1,00:19:30:c0:ff:ee,00:0e:0c:c0:ff:ee,12033  >  80 [SYN] Seq=0 Win=16384 Len=0
17,2010-02-02 09:40:36,164.124.33.94,164.124.33.94,TCP,54,35181,80,164.124.33.94,192.168.0.1,00:19:30:c0:ff:ee,00:0e:0c:c0:ff:ee,35181  >  80 [SYN] Seq=0 Win=16384 Len=0
18,2010-02-02 09:40:36,164.124.33.160,164.124.33.160,TCP,54,35247,80,164.124.33.160,192.168.0.1,00:19:30:c0:ff:ee,00:0e:0c:c0:ff:ee,35247  >  80 [SYN] Seq=0 Win=16384 Len=0
19,2010-02-02 09:40:36,38.198.26.94,38.198.26.94,TCP,54,14463,80,38.198.26.94,192.168.0.1,00:19:30:c0:ff:ee,00:0e:0c:c0:ff:ee,14463  >  80 [SYN] Seq=0 Win=16384 Len=0
20,2010-02-02 09:40:36,132.212.36.219,132.212.36.219,TCP,54,31962,80,38.198.26.94,192.168.0.1,00:19:30:c0:ff:ee,00:0e:0c:c0:ff:ee,31962  >  80 [SYN] Seq=0 Win=16384 Len=0
21,2010-02-02 09:40:36,164.124.33.172,164.124.33.172,TCP,54,35259,80,164.124.33.172,192.168.0.1,00:19:30:c0:ff:ee,00:0e:0c:c0:ff:ee,35259  >  80 [SYN] Seq=0 Win=16384 Len=0
22,2010-02-02 09:40:36,164.124.33.90,164.124.33.90,TCP,54,35177,80,164.124.33.90,192.168.0.1,00:19:30:c0:ff:ee,00:0e:0c:c0:ff:ee,35177  >  80 [SYN] Seq=0 Win=16384 Len=0
23,2010-02-02 09:40:36,132.212.36.218,132.212.36.218,TCP,54,31961,80,132.212.36.218,192.168.0.1,00:19:30:c0:ff:ee,00:0e:0c:c0:ff:ee,31961  >  80 [SYN] Seq=0 Win=16384 Len=0
24,2010-02-02 09:40:36,164.124.33.70,164.124.33.70,TCP,54,35157,80,164.124.33.70,192.168.0.1,00:19:30:c0:ff:ee,00:0e:0c:c0:ff:ee,35157  >  80 [SYN] Seq=0 Win=16384 Len=0
25,2010-02-02 09:40:36,76.196.12.237,76.196.12.237,TCP,54,12020,80,76.196.12.237,192.168.0.1,00:19:30:c0:ff:ee,00:0e:0c:c0:ff:ee,12020  >  80 [SYN] Seq=0 Win=16384 Len=0
26,2010-02-02 09:40:36,164.124.33.73,164.124.33.73,TCP,54,35160,80,164.124.33.73,192.168.0.1,00:19:30:c0:ff:ee,00:0e:0c:c0:ff:ee,35160  >  80 [SYN] Seq=0 Win=16384 Len=0
27,2010-02-02 09:40:36,189.109.37.206,189.109.37.206,TCP,54,36102,80,189.109.37.206,192.168.0.1,00:19:30:c0:ff:ee,00:0e:0c:c0:ff:ee,36102  >  80 [SYN] Seq=0 Win=16384 Len=0
28,2010-02-02 09:40:36,164.124.33.71,164.124.33.71,TCP,54,35158,80,164.124.33.71,192.168.0.1,00:19:30:c0:ff:ee,00:0e:0c:c0:ff:ee,35158  >  80 [SYN] Seq=0 Win=16384 Len=0
29,2010-02-02 09:40:36,61.141.8.140,61.141.8.140,TCP,54,10644,80,61.141.8.140,192.168.0.1,00:19:30:c0:ff:ee,00:0e:0c:c0:ff:ee,10644  >  80 [SYN] Seq=0 Win=16384 Len=0
30,2010-02-02 09:40:36,164.124.33.100,164.124.33.100,TCP,54,35187,80,164.124.33.100,192.168.0.1,00:19:30:c0:ff:ee,00:0e:0c:c0:ff:ee,35187  >  80 [SYN] Seq=0 Win=16384 Len=0
31,2010-02-02 09:40:36,38.198.26.40,38.198.26.40,TCP,54,14409,80,38.198.26.40,192.168.0.1,00:19:30:c0:ff:ee,00:0e:0c:c0:ff:ee,14409  >  80 [SYN] Seq=0 Win=16384 Len=0
32,2010-02-02 09:40:36,76.196.13.19,76.196.13.19,TCP,54,12058,80,76.196.13.19,192.168.0.1,00:19:30:c0:ff:ee,00:0e:0c:c0:ff:ee,12058  >  80 [SYN] Seq=0 Win=16384 Len=0
33,2010-02-02 09:40:36,76.196.13.18,76.196.13.18,TCP,54,12057,80,76.196.13.18,192.168.0.1,00:19:30:c0:ff:ee,00:0e:0c:c0:ff:ee,12057  >  80 [SYN] Seq=0 Win=16384 Len=0
34,2010-02-02 09:40:36,189.109.37.202,189.109.37.202,TCP,54,36098,80,189.109.37.202,192.168.0.1,00:19:30:c0:ff:ee,00:0e:0c:c0:ff:ee,36098  >  80 [SYN] Seq=0 Win=16384 Len=0
35,2010-02-02 09:40:36,164.124.33.97,164.124.33.97,TCP,54,35184,80,164.124.33.97,192.168.0.1,00:19:30:c0:ff:ee,00:0e:0c:c0:ff:ee,35184  >  80 [SYN] Seq=0 Win=16384 Len=0
36,2010-02-02 09:40:36,38.198.26.10,38.198.26.10,TCP,54,14379,80,38.198.26.10,192.168.0.1,00:19:30:c0:ff:ee,00:0e:0c:c0:ff:ee,14379  >  80 [SYN] Seq=0 Win=16384 Len=0
37,2010-02-02 09:40:36,38.198.26.30,38.198.26.30,TCP,54,14399,80,38.198.26.30,192.168.0.1,00:19:30:c0:ff:ee,00:0e:0c:c0:ff:ee,14399  >  80 [SYN] Seq=0 Win=16384 Len=0
38,2010-02-02 09:40:36,38.198.26.41,38.198.26.41,TCP,54,14410,80,38.198.26.41,192.168.0.1,00:19:30:c0:ff:ee,00:0e:0c:c0:ff:ee,14410  >  80 [SYN] Seq=0 Win=16384 Len=0
39,2010-02-02 09:40:36,38.198.26.39,38.198.26.39,TCP,54,14408,80,38.198.26.39,192.168.0.1,00:19:30:c0:ff:ee,00:0e:0c:c0:ff:ee,14408  >  80 [SYN] Seq=0 Win=16384 Len=0
40,2010-02-02 09:40:36,189.109.37.105,189.109.37.105,TCP,54,36001,80,189.109.37.105,192.168.0.1,00:19:30:c0:ff:ee,00:0e:0c:c0:ff:ee,36001  >  80 [SYN] Seq=0 Win=16384 Len=0